{
    "purl": "pkg:maven/ch.acra/acra-core@5.12.0\u00c3",
    "commit": "8d52a1df9fec10b8f2dd95793a3873b49778e011",
    "repo": "https://github.com/ACRA/acra",
    "repo_validated": false,
    "commit_validated": false,
    "url": "https://github.com/ACRA/acra/commit/8d52a1df9fec10b8f2dd95793a3873b49778e011"
}
